question,answer,keyword
Ngành Công nghệ Thực phẩm dành cho những đối tượng nào?,Ngành Công nghệ Thực phẩm dành cho những người học yêu thích hoặc đam mê về công nghệ sản xuất thực phẩm ở quy mô công nghiệp.,"ngành công nghệ thực phẩm, đối tượng phù hợp"
Chương trình đào tạo ngành Công nghệ Thực phẩm bao gồm các môn học cốt lõi nào?,"Chương trình đào tạo bao gồm các môn học cốt lõi về khoa học thực phẩm, dinh dưỡng, kỹ thuật thực phẩm, công nghệ chế biến, đánh giá chất lượng thực phẩm, quản trị sản xuất và chất lượng thực phẩm.","chương trình đào tạo, môn học cốt lõi, khoa học thực phẩm, dinh dưỡng, kỹ thuật thực phẩm"
Sinh viên tốt nghiệp ngành Công nghệ Thực phẩm có khả năng gì?,"Người học được đào tạo để trở thành những kỹ sư có chuyên môn và kỹ năng vững vàng, có khả năng tự học và thích nghi tốt để hội nhập với xu hướng phát triển của ngành trong tương lai.","sinh viên tốt nghiệp, kỹ sư công nghệ thực phẩm, kỹ năng chuyên môn"
"Mục tiêu phát triển các thương hiệu thực phẩm chế biến ""Made in Vietnam"" là gì?",Giúp ngành Công nghiệp thực phẩm của nước ta phát triển bền vững và sánh vai với các nước phát triển trong khu vực Đông Nam Á và châu Á.,"thương hiệu thực phẩm, made in vietnam, phát triển bền vững"
Mã ngành của Chương trình Tiêu chuẩn Công nghệ Thực phẩm là bao nhiêu?,Mã ngành của Chương trình Tiêu chuẩn là 114.,"mã ngành, chương trình tiêu chuẩn"
Mã ngành của Chương trình Dạy và học bằng tiếng Anh Công nghệ Thực phẩm là bao nhiêu?,Mã ngành của Chương trình Dạy và học bằng tiếng Anh là 219.,"mã ngành, chương trình tiếng anh"
Trường ĐH Bách khoa bắt đầu đào tạo ngành Công nghệ Thực phẩm từ khi nào?,"Năm 1976, Trường ĐH Bách khoa là cơ sở đào tạo đầu tiên ở phía Nam nước ta xây dựng và vận hành chương trình đại học ngành Công nghệ Thực phẩm.","lịch sử đào tạo, trường đại học bách khoa"
Chương trình Công nghệ Thực phẩm của Trường ĐH Bách khoa đạt chuẩn kiểm định quốc tế nào?,"Từ năm 2020 đạt chuẩn kiểm định IFT (Hoa Kỳ). Từ năm 2022 đến nay đạt chuẩn kiểm định ASIIN (CHLB Đức), là chương trình đầu tiên và duy nhất ở Việt Nam đạt chuẩn này.","kiểm định quốc tế, ift, asiin, chuẩn hoa kỳ, chuẩn đức"
Chương trình đào tạo ngành Công nghệ Thực phẩm được cập nhật theo tiêu chí nào?,Chương trình đào tạo được cập nhật bốn năm một lần theo khối kiến thức do Hiệp hội các nhà Công nghệ Thực phẩm Hoa Kỳ khuyến nghị.,"cập nhật chương trình, hiệp hội các nhà công nghệ thực phẩm hoa kỳ"
Điểm nhấn của chương trình Công nghệ Thực phẩm tại ĐH Bách khoa là gì?,Điểm nhấn là cung cấp những kiến thức chuyên sâu về kỹ thuật và công nghệ. Chương trình cũng chú trọng cung cấp các kỹ năng mềm cho người học.,"điểm nhấn chương trình, kiến thức kỹ thuật, kỹ năng mềm"
Hệ thống phòng thí nghiệm Công nghệ Thực phẩm tại Trường có diện tích bao nhiêu?,Hệ thống phòng thí nghiệm Công nghệ Thực phẩm tại Trường ĐH Bách khoa có diện tích hơn 1000m2.,"cơ sở vật chất, phòng thí nghiệm, diện tích phòng thí nghiệm"
Hệ thống phòng thí nghiệm có bao nhiêu module chính?,Hệ thống phòng thí nghiệm có 5 module chính.,"phòng thí nghiệm, module phòng thí nghiệm"
Module phân tích trong phòng thí nghiệm dùng để làm gì?,"Module phân tích dùng để phân tích những thành phần dinh dưỡng, độc tố và tính chất hóa lý của thực phẩm.","module phân tích, phân tích dinh dưỡng, phân tích độc tố, tính chất hóa lý"
Module vi sinh vật trong phòng thí nghiệm dùng để làm gì?,Module vi sinh vật dùng để phân tích vi sinh vật.,"module vi sinh vật, phân tích vi sinh vật"
Module đánh giá cảm quan trong phòng thí nghiệm dùng để làm gì?,Module đánh giá cảm quan dùng để đánh giá cảm quan thực phẩm.,"module đánh giá cảm quan, đánh giá cảm quan"
Module nghiên cứu phát triển quy trình công nghệ mới tập trung vào gì?,Module này tập trung nghiên cứu phát triển những quy trình công nghệ mới để làm tăng chất lượng thực phẩm và giảm tổn thất sản xuất.,"module nghiên cứu phát triển, quy trình công nghệ, tăng chất lượng thực phẩm, giảm tổn thất sản xuất"
Module nghiên cứu phát triển thực phẩm mới tập trung vào gì?,"Module này tập trung nghiên cứu phát triển thực phẩm mới như thực phẩm phòng/ trị bệnh, thực phẩm không sử dụng phụ gia tổng hợp.","module nghiên cứu phát triển, thực phẩm mới, thực phẩm phòng trị bệnh, thực phẩm không phụ gia"
Phòng thí nghiệm có thiết bị quy mô sản xuất công nghiệp không?,"Có, hệ thống phòng thí nghiệm có những thiết bị ở quy mô sản xuất công nghiệp để sinh viên thực tập chế biến.","thiết bị công nghiệp, thực tập chế biến"
Sinh viên có thể thực tập chế biến nhóm thực phẩm nào bằng thiết bị công nghiệp?,"Sinh viên có thể thực tập chế biến nhóm thực phẩm sấy phun, nhóm thực phẩm ép đùn, nhóm sản phẩm chiên chân không, nhóm đồ hộp thịt, cá, rau/quả tiệt trùng.","thực tập chế biến, sấy phun, ép đùn, chiên chân không, đồ hộp"
Sinh viên tốt nghiệp ngành Công nghệ Thực phẩm có thể làm quản lý ở bộ phận nào tại công ty?,"Sinh viên tốt nghiệp có thể làm quản lý tại các bộ phận sản xuất, quản trị chất lượng, nghiên cứu và phát triển sản phẩm mới.","vị trí việc làm, quản lý sản xuất, quản trị chất lượng, nghiên cứu phát triển"
Tốt nghiệp ngành Công nghệ Thực phẩm có thể làm việc tại loại hình công ty nào?,"Sinh viên có thể làm việc tại những công ty sản xuất nguyên phụ liệu ngành thực phẩm, phụ gia thực phẩm và thực phẩm công nghiệp.","loại hình công ty, nguyên phụ liệu thực phẩm, phụ gia thực phẩm, thực phẩm công nghiệp"
Sinh viên tốt nghiệp có thể làm công việc tư vấn công nghệ không?,"Có, có thể làm quản lý hoặc tư vấn công nghệ kỹ thuật và công thức phát triển sản phẩm tại những công ty kinh doanh nguyên phụ liệu, phụ gia, thực phẩm công nghiệp.","tư vấn công nghệ, công thức phát triển sản phẩm"
Sinh viên tốt nghiệp có thể làm giảng dạy hoặc nghiên cứu không?,"Có, có thể làm giảng dạy và nghiên cứu tại các trường cao đẳng, đại học và viện nghiên cứu về khoa học và công nghệ thực phẩm.","giảng dạy, nghiên cứu khoa học, viện nghiên cứu"
Sinh viên tốt nghiệp có thể làm tư vấn tại cơ quan nhà nước không?,"Có, có thể làm tư vấn tại những cơ quan quản lý nhà nước, tổ chức chính phủ phi chính phủ để thực hiện các dự án liên quan đến sản xuất, kinh doanh, an toàn thực phẩm.","tư vấn nhà nước, an toàn thực phẩm"
Sinh viên tốt nghiệp có thể tự khởi nghiệp không?,"Có, có thể tự khởi nghiệp hoặc hợp tác với đối tác xây dựng và phát triển công ty sản xuất và/ hoặc kinh doanh.","tự khởi nghiệp, kinh doanh thực phẩm"
Trường ĐH Bách khoa có quan hệ hợp tác với những đơn vị nào trong lĩnh vực thực phẩm?,"Trường ĐH Bách khoa có quan hệ hợp tác với nhiều công ty sản xuất và kinh doanh trong lĩnh vực thực phẩm, các trường đại học và viện nghiên cứu về thực phẩm ở trong và ngoài nước.","quan hệ hợp tác, công ty thực phẩm, viện nghiên cứu"
Đã có bao nhiêu kỹ sư tốt nghiệp ngành Công nghệ Thực phẩm từ Trường ĐH Bách khoa kể từ năm 1976?,"Hơn 3000 kỹ sư tốt nghiệp ngành Công nghệ Thực phẩm của trường đã và đang giữ vị trí lãnh đạo và chuyên gia tại những tập đoàn, công ty uy tín.","số lượng kỹ sư, cựu sinh viên"
Các công ty có tuyển dụng sinh viên ngành Công nghệ Thực phẩm từ trường không?,"Có, các công ty thường xuyên gửi thông báo tuyển dụng sinh viên đến trường và tham gia ngày hội tuyển dụng hàng năm tại trường.","tuyển dụng sinh viên, ngày hội tuyển dụng"
Sinh viên ngành Công nghệ Thực phẩm có những cơ hội học bổng nào?,"Sinh viên có cơ hội nhận học bổng chung của trường và học bổng từ các công ty sản xuất/kinh doanh thực phẩm, cựu sinh viên, và doanh nghiệp hợp tác nghiên cứu/đào tạo.","học bổng, học bổng doanh nghiệp, học bổng cựu sinh viên"
Sinh viên năm 4 có cơ hội nhận học bổng đi thực tập ở đâu?,"Hàng năm, sinh viên năm 4 có thể nhận học bổng đi thực tập chuyên ngành tại các trường đại học ở châu Âu (Pháp, Đức) và châu Á (Nhật Bản, Singapore).","học bổng thực tập, thực tập nước ngoài"
Sinh viên tốt nghiệp có thể nhận học bổng du học sau đại học ở đâu?,"Sau khi tốt nghiệp đại học, nhiều sinh viên nhận được học bổng để theo học chương trình sau đại học ngành Công nghệ Thực phẩm tại Canada, Hoa Kỳ, Đan Mạch, Úc....","học bổng sau đại học, du học"
Địa chỉ liên hệ của Trường Đại học Bách khoa - ĐHQG-HCM là gì?,"Địa chỉ là Tòa B2, Trường Đại học Bách khoa - ĐHQG-HCM, 268 Lý Thường Kiệt, Phường 14, Quận 10, TP. Hồ Chí Minh.","địa chỉ liên hệ, trường đại học bách khoa"
Số điện thoại liên hệ tư vấn tuyển sinh là bao nhiêu?,Số điện thoại liên hệ là 028 2214 6888.,"số điện thoại, liên hệ tư vấn tuyển sinh"
Trang Facebook tư vấn tuyển sinh của trường là gì?,Trang Facebook tư vấn tuyển sinh là fb.com/tuvantuyensinhbachkhoa.,"facebook, tư vấn tuyển sinh"
Website liên hệ của trường là gì?,Website liên hệ là dch.hcmut.edu.vn.,"website, liên hệ"
Địa chỉ email liên hệ tư vấn tuyển sinh là gì?,Địa chỉ email liên hệ tư vấn tuyển sinh là tuvantuyensinh@hcmut.edu.vn.,"email, liên hệ tư vấn tuyển sinh"
