question,answer,keyword
Ngành Cơ Kỹ thuật là gì?,"Là ngành ứng dụng nguyên lý Cơ học, Toán học để phân tích, tính toán và giải quyết vấn đề kỹ thuật đa ngành.","ngành cơ kỹ thuật, cơ học, toán học, phân tích, tính toán"
Mục tiêu đào tạo tổng quát của ngành Cơ Kỹ thuật là gì?,"Đào tạo kỹ sư có năng lực chuyên môn, đạo đức nghề nghiệp và sức khỏe tốt để phụng sự cho đất nước.","mục tiêu đào tạo, kỹ sư cơ kỹ thuật, năng lực chuyên môn, đạo đức nghề nghiệp"
Sinh viên Cơ Kỹ thuật được trang bị những kiến thức nào?,"Kiến thức cơ bản, cơ sở ngành giúp tự tin hoạt động nghề nghiệp, giải quyết độc lập vấn đề kỹ thuật thuộc lĩnh vực cơ học kỹ thuật.","kiến thức cơ bản, cơ sở ngành, hoạt động nghề nghiệp, cơ học kỹ thuật"
Các hướng nghiên cứu và ứng dụng chính của ngành Cơ Kỹ thuật là gì?,"Mô phỏng Cơ Kỹ thuật, Kỹ thuật đo lường, Động lực học và điều khiển.","hướng nghiên cứu, mô phỏng cơ kỹ thuật, kỹ thuật đo lường, động lực học và điều khiển"
Sinh viên tốt nghiệp Cơ Kỹ thuật có khả năng tính toán mô phỏng gì?,"Tính toán mô phỏng các kết cấu cơ khí, xây dựng, cầu đường, hệ thống đường ống, cơ lưu chất, cơ sinh học, hệ thống nhiệt.","tính toán mô phỏng, kết cấu cơ khí, xây dựng, cầu đường, cơ lưu chất, cơ sinh học"
Chương trình đào tạo Cơ Kỹ thuật được xây dựng dựa trên cơ sở nào?,"Kinh nghiệm đào tạo từ 2002, tham khảo chương trình nước ngoài, ý kiến chuyên gia, khảo sát doanh nghiệp và cựu sinh viên.","chương trình đào tạo, kinh nghiệm, tham khảo, ý kiến chuyên gia, doanh nghiệp"
Mã ngành cho chương trình Tiêu chuẩn Cơ Kỹ thuật là gì?,Mã ngành là 138.,"mã ngành, chương trình tiêu chuẩn, 138"
Mã ngành cho chương trình Định hướng Nhật Bản Cơ Kỹ thuật là gì?,Mã ngành là 268.,"mã ngành, định hướng nhật bản, 268"
Những điểm đặc biệt của ngành Cơ Kỹ thuật là gì?,"Nắm vững kiến thức cơ học, công cụ toán học, lập trình tin học, trải nghiệm phần mềm chuyên dụng, trải nghiệm vấn đề thực tiễn cơ học.","điểm đặc biệt, cơ học, toán học, lập trình, phần mềm chuyên dụng, thực tiễn cơ học"
Sinh viên Cơ Kỹ thuật được trải nghiệm những phần mềm chuyên dụng nào?,"Sinh viên được trải nghiệm các phần mềm như ANSYS, ABAQUS, MATLAB.","phần mềm chuyên dụng, ansys, abaqus, matlab"
Cơ sở vật chất phục vụ đào tạo ngành Cơ Kỹ thuật như thế nào?,"Có phòng thực hành trang bị phần mềm tính toán thiết kế và các xưởng thực nghiệm, chế tạo trang bị máy CNC.","cơ sở vật chất, phòng thực hành, xưởng thực nghiệm, máy cnc"
Kỹ sư Cơ Kỹ thuật có thể làm việc ở những vị trí nào sau tốt nghiệp?,"Viện nghiên cứu, trung tâm lập trình phần mềm, trường đại học, phòng thiết kế kỹ thuật công ty, cơ quan đảm bảo chất lượng.","vị trí việc làm, viện nghiên cứu, trung tâm lập trình, trường đại học, phòng thiết kế"
Những doanh nghiệp nào thường xuyên tuyển dụng kỹ sư Cơ Kỹ thuật?,"Robert Bosch, Mercedes-Benz, Vietsovpetro, Alpha-ECC, Nike, Schindler, Technip, Hitachi Zosen, Samco, TechnoStar, Akselos, Danieli...","quan hệ hợp tác, doanh nghiệp, tuyển dụng"
Sinh viên Cơ Kỹ thuật có cơ hội nhận học bổng không?,"Có, sinh viên có kết quả học tốt có thể được hỗ trợ học bổng từ trường, doanh nghiệp, cựu sinh viên.","học bổng, học bổng khuyến khích, doanh nghiệp, cựu sinh viên"
Sinh viên Cơ Kỹ thuật muốn học Sau Đại học có được hỗ trợ không?,"Có, sinh viên học tốt và có nguyện vọng học Sau Đại học được hỗ trợ tham gia các nhóm nghiên cứu của giảng viên trong khoa.","học sau đại học, hỗ trợ, nhóm nghiên cứu giảng viên"
Khoa Cơ Kỹ thuật có hoạt động trao đổi sinh viên quốc tế không?,"Có, khoa có các hoạt động trao đổi với các đối tác quốc tế.","trao đổi quốc tế, đối tác quốc tế"
Sinh viên Cơ Kỹ thuật có cơ hội nhận học bổng toàn phần Sau Đại học không?,"Có, khoa có các cơ hội học bổng toàn phần Sau Đại học từ các đối tác quốc tế.","học bổng toàn phần, sau đại học, đối tác quốc tế"
Các trường đại học đối tác quốc tế của khoa Cơ Kỹ thuật là những trường nào?,"Bao gồm các trường ở Ireland, Hungary, Nhật Bản, Đài Loan như Munster TU, University of Sopron, Hokkaido U, Osaka U, Waseda U,...","đối tác quốc tế, ireland, hungary, nhật bản, đài loan"
Làm thế nào để liên hệ với khoa Cơ Kỹ thuật?,"Có thể liên hệ qua địa chỉ, số điện thoại, trang Facebook hoặc website chính thức được cung cấp.","liên hệ, địa chỉ, số điện thoại, facebook, website"
Địa chỉ cụ thể của khoa Cơ Kỹ thuật là ở đâu?,"Phòng 101 B4, Trường Đại học Bách khoa - ĐHQG-HCM, 268 Lý Thường Kiệt, Phường 14, Quận 10, TP. Hồ Chí Minh.","địa chỉ liên hệ, phòng 101 b4, lý thường kiệt, đại học bách khoa"
Số điện thoại liên hệ của khoa Cơ Kỹ thuật là gì?,Số điện thoại là (028) 38647256-Ext 5317.,"số điện thoại, liên hệ, 028 38647256"
Trang Facebook chính thức của khoa Cơ Kỹ thuật là gì?,Trang Facebook là fb.com/fas.hcmut.,"facebook, liên hệ, fas.hcmut"
Trang web chính thức của khoa Cơ Kỹ thuật là gì?,Các trang web là fas.hcmut.edu.vn và fascthcmut.edu.vn.,"trang web, liên hệ, fas.hcmut.edu.vn, fascthcmut.edu.vn"
