question,answer,keyword
Ngành Khoa học Dữ liệu thuộc Khoa nào?,Ngành Khoa học Dữ liệu là một ngành của Khoa Khoa học Ứng dụng.,"khoa học dữ liệu, khoa khoa học ứng dụng"
Ngành Khoa học Dữ liệu bắt đầu tuyển sinh từ năm nào?,Ngành Khoa học Dữ liệu bắt đầu tuyển sinh từ năm 2024.,"tuyển sinh, 2024"
Vì sao ngành Khoa học Dữ liệu ra đời?,"Ngành ra đời nhằm đáp ứng nhu cầu ngày càng tăng về việc làm trong lĩnh vực Khoa học Dữ liệu, đặc biệt là nguồn nhân lực có chuyên môn cao.","nhu cầu việc làm, nhân lực chuyên môn cao"
Sứ mệnh của ngành Khoa học Dữ liệu là gì?,"Sứ mệnh là đào tạo những Cử nhân Kỹ thuật trình độ cao, kiến thức chuyên sâu có tính liên ngành và thời sự cấp thiết cho nhiều ứng dụng công nghệ cao.","sứ mệnh đào tạo, cử nhân kỹ thuật, kiến thức chuyên sâu"
Cơ hội việc làm và mức lương cho chuyên gia Khoa học Dữ liệu ra sao?,Các chuyên gia trong lĩnh vực này đều được trả lương cao và có cơ hội làm việc ở nhiều lĩnh vực khác nhau.,"cơ hội việc làm, lương cao"
Đối tượng phù hợp để học ngành Khoa học Dữ liệu là ai?,"Là học sinh/sinh viên có khả năng học toán, thống kê, lập trình; yêu thích trí tuệ nhân tạo, dữ liệu đa lĩnh vực.","đối tượng, học toán, thống kê, lập trình, trí tuệ nhân tạo"
Ngành Khoa học Dữ liệu có tính liên ngành không?,"Có, Khoa học Dữ liệu là một ngành học có tính liên ngành rất cao.",tính liên ngành
Ngành Khoa học Dữ liệu có những trụ cột kiến thức nào?,"Có ba trụ cột chính là Toán và Thống kê, Khoa học máy tính và lĩnh vực tri thức liên ngành.","trụ cột kiến thức, toán, thống kê, khoa học máy tính, lĩnh vực liên ngành"
Chương trình đào tạo Khoa học Dữ liệu dựa trên tiêu chuẩn nào?,Chương trình đào tạo được thiết kế dựa trên bộ tiêu chuẩn ABET và bộ kỹ năng nghề nghiệp của IBM.,"chương trình đào tạo, tiêu chuẩn abet, kỹ năng ibm"
Sinh viên tốt nghiệp Khoa học Dữ liệu có khả năng gì về dữ liệu?,"Có khả năng xử lý, phân tích và trực quan hoá dữ liệu.","khả năng, xử lý dữ liệu, phân tích dữ liệu, trực quan hóa dữ liệu"
Sinh viên tốt nghiệp có kỹ năng sử dụng phần mềm xử lý dữ liệu không?,"Có, sinh viên có kỹ năng sử dụng nhiều phần mềm xử lý dữ liệu.","kỹ năng, phần mềm xử lý dữ liệu"
Sinh viên tốt nghiệp có khả năng ứng dụng kiến thức vào thực tế không?,"Có, sinh viên có khả năng ứng dụng các kiến thức và kỹ năng khoa học dữ liệu vào thực tế cuộc sống.","ứng dụng kiến thức, thực tế"
Sinh viên tốt nghiệp có thể đảm nhận vai trò quản lý dự án không?,"Có, sinh viên tốt nghiệp có thể lập kế hoạch, triển khai và quản lý dự án liên quan dữ liệu.","quản lý dự án, lập kế hoạch, triển khai"
Sinh viên được trang bị kiến thức nào về toán học và xác suất thống kê?,Sinh viên được trang bị kiến thức vững chắc về toán học và xác suất thống kê.,"toán học, xác suất thống kê"
Sinh viên có khả năng xử lý dữ liệu thành thạo không?,"Có, sinh viên được bổ sung kiến thức chuyên môn, có khả năng xử lý dữ liệu thành thạo.","xử lý dữ liệu thành thạo, kiến thức chuyên môn"
Những phần mềm xử lý dữ liệu nào được sinh viên sử dụng thành thạo?,"Python, R, SQL, PowerBI, Tableau.","phần mềm xử lý dữ liệu, python, r, sql, powerbi, tableau"
Làm thế nào để sinh viên cập nhật các chủ đề mới nhất trong ngành?,"Thông qua các buổi seminar, workshop, thực tập.","cập nhật chủ đề, seminar, workshop, thực tập"
Sinh viên có cơ hội giao lưu học hỏi từ những ai?,"Từ những doanh nhân, những nhà nghiên cứu thành đạt trong các lĩnh vực đang được quan tâm.","giao lưu, doanh nhân, nhà nghiên cứu"
Các chủ đề nào trong khoa học dữ liệu đang được quan tâm và được đề cập?,"Trí tuệ Nhân tạo, Blockchain, giải trình tự gen.","chủ đề quan tâm, trí tuệ nhân tạo, blockchain, giải trình tự gen"
Sinh viên từ những ngành nào có thể học liên thông Khoa học Dữ liệu?,"Khoa học Máy tính, Quản lý Công nghiệp, Cơ Kỹ thuật, Vật lý Kỹ thuật, Công nghệ sinh học.","liên thông, khoa học máy tính, quản lý công nghiệp, cơ kỹ thuật, vật lý kỹ thuật, công nghệ sinh học"
Thời gian học liên thông ngành Khoa học Dữ liệu là bao lâu?,Thời gian từ 1-2 năm.,"thời gian liên thông, 1-2 năm"
Cơ sở vật chất phục vụ đào tạo ngành Khoa học Dữ liệu có gì đặc biệt?,"Sử dụng các phòng thí nghiệm, phòng lab với nhiều thiết bị chuyên dụng, được đầu tư.","cơ sở vật chất, phòng thí nghiệm, phòng lab, thiết bị chuyên dụng"
Các phòng thí nghiệm/phòng lab được đặt ở đâu?,Được đầu tư ở cả hai cơ sở Lý Thường Kiệt và Dĩ An của trường.,"địa điểm, cơ sở lý thường kiệt, cơ sở dĩ an"
Các vị trí công việc phát triển nhanh nhất trong lĩnh vực Khoa học Dữ liệu là gì?,"Kỹ sư học máy, Nhà khoa học dữ liệu, Nhà phát triển dữ liệu lớn.","vị trí việc làm, kỹ sư học máy, nhà khoa học dữ liệu, nhà phát triển dữ liệu lớn"
Sinh viên tốt nghiệp có thể làm việc ở các vai trò nào liên quan dữ liệu?,"Phân tích, quản trị, phát triển và ứng dụng khoa học dữ liệu.","vai trò, phân tích dữ liệu, quản trị dữ liệu, phát triển ứng dụng"
Sinh viên tốt nghiệp Khoa học Dữ liệu có thể làm việc trong ngành Công nghệ không?,Có.,ngành công nghệ
Các công ty công nghệ nào tuyển dụng kỹ sư Khoa học Dữ liệu?,"FPT, Zalo, TalentNex Consulting Pte Ltd., Viettel, Dagoras.","công ty công nghệ, fpt, zalo, viettel, dagoras"
Sinh viên tốt nghiệp Khoa học Dữ liệu có thể làm việc trong ngành Tài chính - Ngân hàng không?,Có.,"ngành tài chính, ngân hàng"
Các công ty/ngân hàng nào trong ngành Tài chính - Ngân hàng tuyển dụng kỹ sư Khoa học Dữ liệu?,"Worldquant, Kyber network, HD Saigon Finance, Sacombank, Techcombank, VPbank, PNJ, các công ty chứng khoán.","công ty tài chính, ngân hàng, sacombank, techcombank, vpbank, pnj"
Sinh viên tốt nghiệp Khoa học Dữ liệu có thể làm việc trong ngành Thương mại điện tử không?,Có.,ngành thương mại điện tử
Các công ty nào trong ngành Thương mại điện tử tuyển dụng kỹ sư Khoa học Dữ liệu?,"Shopee, Lazada, Momo.","công ty thương mại điện tử, shopee, lazada, momo"
Sinh viên tốt nghiệp Khoa học Dữ liệu có thể làm việc trong ngành Dịch vụ hậu cần không?,Có.,"ngành dịch vụ hậu cần, logistics"
Các công ty nào trong ngành Dịch vụ hậu cần tuyển dụng kỹ sư Khoa học Dữ liệu?,"Ahamove, Giao hàng nhanh.","công ty dịch vụ hậu cần, ahamove, giao hàng nhanh"
Sinh viên tốt nghiệp Khoa học Dữ liệu có thể làm việc trong ngành Sản xuất không?,Có.,ngành sản xuất
Các công ty nào trong ngành Sản xuất tuyển dụng kỹ sư Khoa học Dữ liệu?,"Unilever, Pepsi, TH Farm.","công ty sản xuất, unilever, pepsi, th farm"
Sinh viên tốt nghiệp Khoa học Dữ liệu có thể làm việc trong ngành Công nghệ sinh học không?,Có.,ngành công nghệ sinh học
Các công ty nào trong ngành Công nghệ sinh học tuyển dụng kỹ sư Khoa học Dữ liệu?,"Bioturing, Pacific Informatics.","công ty công nghệ sinh học, bioturing, pacific informatics"
Sinh viên tốt nghiệp Khoa học Dữ liệu có thể làm Giảng viên/Nghiên cứu viên không?,"Có, có thể làm Giảng viên, nghiên cứu viên tại các trường Đại học hoặc viện nghiên cứu.","giảng viên, nghiên cứu viên, trường đại học, viện nghiên cứu"
Ngành Khoa học Dữ liệu có hợp tác với doanh nghiệp không?,"Có, thông qua các hoạt động hợp tác chung của khoa Khoa học Ứng dụng và Bộ môn Toán.","hợp tác doanh nghiệp, khoa khoa học ứng dụng, bộ môn toán"
Mục đích của việc hợp tác với doanh nghiệp là gì?,"Để mở rộng quan hệ, thu thập ý kiến phản hồi nhằm nâng cao chất lượng giảng dạy và tạo điều kiện cho sinh viên/học viên tham gia thực tập thực tế.","mục đích hợp tác, nâng cao chất lượng giảng dạy, thực tập thực tế"
Sinh viên có cơ hội nhận học bổng không?,"Có, sinh viên có kết quả học tốt có thể được hỗ trợ học bổng.",học bổng
Các loại học bổng nào sinh viên có thể nhận được?,"Học bổng khuyến khích của trường, học bổng từ doanh nghiệp, học bổng đồng hành từ các cựu sinh viên ngành Cơ Kỹ thuật.","học bổng khuyến khích, học bổng doanh nghiệp, học bổng cựu sinh viên, ngành cơ kỹ thuật"
Sinh viên có nguyện vọng học Sau Đại học có được hỗ trợ không?,"Có, sinh viên học tốt và có nguyện vọng học Sau Đại học được hỗ trợ tham gia các nhóm nghiên cứu của giảng viên trong khoa.","học sau đại học, hỗ trợ, nhóm nghiên cứu giảng viên"
Khoa có các hoạt động trao đổi sinh viên quốc tế không?,"Có, khoa có các hoạt động trao đổi với các đối tác quốc tế.","trao đổi quốc tế, đối tác quốc tế"
Có cơ hội nhận học bổng toàn phần Sau Đại học ở nước ngoài không?,"Có, khoa có các cơ hội học bổng toàn phần Sau Đại học từ các đối tác quốc tế.","học bổng toàn phần, sau đại học, đối tác quốc tế"
Các đối tác quốc tế của khoa cho học bổng/trao đổi ở những quốc gia nào?,"Ireland, Hungary, Nhật Bản, Đài Loan.","đối tác quốc tế, ireland, hungary, nhật bản, đài loan"
Trường Munster Technological University (Ireland) có phải là đối tác không?,Có.,"munster technological university, ireland, đối tác quốc tế"
Trường University of Sopron (Hungary) có phải là đối tác không?,Có.,"university of sopron, hungary, đối tác quốc tế"
Có bao nhiêu trường đại học ở Nhật Bản là đối tác của khoa?,"Có 6 trường: Hokkaido U, Osaka U, Waseda U, Chiba U, Tokyo Metropolitan U, Kyushu Institute of Technology.","nhật bản, đối tác quốc tế, hokkaido u, osaka u, waseda u, chiba u, tokyo metropolitan u, kyushu institute of technology"
Có bao nhiêu trường đại học ở Đài Loan là đối tác của khoa?,"Có 3 trường: National Chung-Hsing U, National Sun Yat-Sen U, National Cheng Kung U.","đài loan, đối tác quốc tế, national chung-hsing u, national sun yat-sen u, national cheng kung u"
Làm thế nào để liên hệ với ngành Khoa học Dữ liệu?,"Có thể liên hệ qua địa chỉ, số điện thoại, trang Facebook hoặc website chính thức.",liên hệ
Địa chỉ liên hệ của ngành Khoa học Dữ liệu ở đâu?,"Phòng 101 B4, Trường Đại học Bách khoa - ĐHQG-HCM, 268 Lý Thường Kiệt, Phường 14, Quận 10, TP. Hồ Chí Minh.","địa chỉ liên hệ, phòng 101 b4, lý thường kiệt, quận 10"
Số điện thoại liên hệ của ngành Khoa học Dữ liệu là gì?,Số điện thoại là (028) 38647256-Ext 5317.,số điện thoại liên hệ
Trang Facebook chính thức của ngành Khoa học Dữ liệu là gì?,Trang Facebook là fb.com/fas.hcmut.,"facebook, liên hệ, fas.hcmut"
Các trang web chính thức của ngành Khoa học Dữ liệu là gì?,Các trang web là fas.hcmut.edu.vn và fascthcmut.edu.vn.,"website, liên hệ, fas.hcmut.edu.vn, fascthcmut.edu.vn"
,,
"Tôi đã tạo 50+ câu hỏi dựa trên thông tin có trong nguồn tài liệu bạn cung cấp, tuân thủ các yêu cầu về định dạng và nội dung.",,
,,
Hy vọng danh sách này hữu ích cho bạn!,,
