question,answer,keyword
Ngành Kỹ thuật Điện dành cho những sinh viên nào?,"Ngành Kỹ thuật Điện dành cho sinh viên có sở thích và đam mê làm việc trong lĩnh vực công nghệ tiên tiến phục vụ quá trình phát, truyền tải, phân phối và sử dụng điện năng.","kỹ thuật điện, sinh viên, đam mê công nghệ, điện năng"
Mục tiêu đào tạo của chương trình Kỹ thuật Điện là gì?,"Chương trình đào tạo sinh viên thành những kỹ sư có tay nghề cao, có thể thiết kế các giải pháp cho các vấn đề thuộc lĩnh vực Kỹ thuật Điện trong nhiều ngành.","mục tiêu đào tạo, kỹ sư, giải pháp, kỹ thuật điện"
Sinh viên tốt nghiệp ngành Kỹ thuật Điện có năng lực gì?,"Sinh viên có năng lực giải quyết vấn đề liên quan đến sản xuất, truyền tải, phân phối và sử dụng điện, bao gồm thiết kế, sản xuất, vận hành, bảo dưỡng hệ thống năng lượng điện.","tốt nghiệp, năng lực, sản xuất điện, truyền tải điện, phân phối điện, sử dụng điện"
Kỹ sư Kỹ thuật Điện sau tốt nghiệp có thể đảm nhận công việc gì?,"Kỹ sư đảm nhận công việc của người kỹ sư trong lĩnh vực Kỹ thuật Điện, có khả năng thích nghi và áp dụng công nghệ tiên tiến phục vụ công nghiệp hóa, hiện đại hóa đất nước.","kỹ sư tốt nghiệp, công việc, thích nghi, công nghệ tiên tiến"
Ngành Kỹ thuật Điện có vai trò như thế nào đối với kinh tế xã hội?,"Ngành Kỹ thuật Điện đóng góp tích cực đến sự phát triển kinh tế xã hội của đất nước, đặc biệt trong cách mạng công nghiệp 4.0 và phát triển năng lượng tái tạo, xe điện, lưới điện thông minh.","vai trò, kinh tế xã hội, công nghiệp 4.0, năng lượng tái tạo, xe điện, lưới điện thông minh"
Mã ngành của chương trình Kỹ thuật Điện Tiêu chuẩn là bao nhiêu?,Mã ngành của Chương trình Tiêu chuẩn là 108.,"mã ngành, chương trình tiêu chuẩn"
Mã ngành của chương trình Kỹ thuật Điện Tiên tiến là bao nhiêu?,Mã ngành của Chương trình Tiên tiến là 208.,"mã ngành, chương trình tiên tiến"
Chương trình đào tạo Kỹ thuật Điện bao gồm các môn học cốt lõi nào?,Chương trình bao gồm các môn học cốt lõi về kỹ thuật điện - điện tử nói chung và kỹ thuật điện nói riêng.,"chương trình đào tạo, môn học cốt lõi, kỹ thuật điện, kỹ thuật điện tử"
Các môn học chuyên ngành tiêu biểu trong Kỹ thuật Điện là gì?,"Các môn học chuyên ngành liên quan đến thiết kế, điều khiển máy điện, xe điện, bộ biến đổi điện tử công suất, hệ thống điện truyền tải, phân phối, nhà máy điện (gió, mặt trời).","môn học chuyên ngành, máy điện, xe điện, điện tử công suất, hệ thống điện, nhà máy điện"
Ngành Kỹ thuật Điện có những điểm đặc biệt nào?,"Ngành nghề then chốt, kỹ thuật cao, bền vững; có việc ngay, mức lương tốt; chương trình uy tín (CDIO, AQAS); truyền thống lâu đời, giảng viên tâm huyết; cơ hội học song ngành, liên thông Thạc sĩ.","điểm đặc biệt, then chốt, kỹ thuật cao, bền vững, việc làm, lương tốt, CDIO, AQAS, song ngành, liên thông"
Môi trường học tập ngành Kỹ thuật Điện như thế nào?,"Môi trường học tập năng động, toàn diện, nhiều môn học sử dụng ngôn ngữ tiếng Anh.","môi trường học tập, năng động, toàn diện, tiếng anh"
Sinh viên Kỹ thuật Điện có cơ hội học song ngành không?,Có cơ hội học song ngành với Kỹ thuật Điều khiển & Tự động hóa hoặc Điện tử - Viễn thông với thời gian rút ngắn để nhận 02 bằng.,"song ngành, kỹ thuật điều khiển tự động hóa, điện tử viễn thông"
Sinh viên Kỹ thuật Điện có thể học liên thông lên Thạc sĩ không?,Có cơ hội học liên thông lên Thạc sĩ với thời gian rút ngắn để nhận bằng Cử nhân và Thạc sỹ của Trường.,"liên thông, thạc sĩ"
Sinh viên Khoa Điện - Điện tử có những lợi thế gì?,"Tự hào là sinh viên Khoa có truyền thống lâu đời, nhiều cơ hội tiếp cận việc làm và học bổng quốc tế.","khoa điện điện tử, truyền thống, việc làm quốc tế, học bổng quốc tế"
Sinh viên tốt nghiệp Kỹ thuật Điện có cơ hội học sau đại học ở nước ngoài không?,Có cơ hội được giới thiệu học tiếp các chương trình đào tạo sau đại học ở các nước tiên tiến khu vực và thế giới.,"học sau đại học, du học, nước ngoài"
Cơ sở vật chất phục vụ đào tạo Kỹ thuật Điện như thế nào?,"Có các phòng thí nghiệm chất lượng cao phục vụ đào tạo và nghiên cứu, giúp sinh viên có kinh nghiệm thiết kế và vận hành thiết bị, hệ thống chuyên nghiệp.","cơ sở vật chất, phòng thí nghiệm, thiết bị, hệ thống"
Các phòng thí nghiệm có nhận tài trợ từ doanh nghiệp không?,Các phòng thí nghiệm thường xuyên nhận tài trợ của doanh nghiệp về thiết bị và phần mềm chuyên dụng phổ biến trong ngành.,"phòng thí nghiệm, tài trợ doanh nghiệp, thiết bị chuyên dụng"
Nhu cầu nhân lực ngành Kỹ thuật Điện hiện nay và tương lai ra sao?,"Nhu cầu nguồn nhân lực, đặc biệt chất lượng cao, của ngành Kỹ thuật Điện là rất lớn hiện nay và tương lai, nhất là giai đoạn bùng nổ năng lượng tái tạo và lưới điện thông minh.","nhu cầu nhân lực, chất lượng cao, năng lượng tái tạo, lưới điện thông minh"
Các vị trí việc làm cụ thể cho kỹ sư Kỹ thuật Điện tốt nghiệp là gì?,"Thiết kế thiết bị điện/điện tử công suất, bộ điều khiển máy điện, hệ thống năng lượng tái tạo, mạng điện, trạm biến áp, nhà máy điện, giải thuật điều khiển, quản lý/vận hành lưới điện, thiết kế chiếu sáng, phân tích ổn định, bảo vệ relay, tự động hóa hệ thống điện, kỹ thuật cao áp, vật liệu cách điện, phân tích dữ liệu/hệ thống, điều khiển thời gian thực, lập trình giao tiếp.","vị trí việc làm, kỹ sư, thiết kế, vận hành, quản lý, phân tích, tự động hóa"
Những công ty lớn nào thường tuyển dụng kỹ sư Kỹ thuật Điện từ Trường?,"EVN, PECC2-5, Schneider Electric, Siemens, ABB, GE, Intel, Mitsubishi, Hitachi Energy, Infineon, Bosch, Solar-BK, Vin-Fast, AfterFIT, VATEC, ATS, Shizen Energy và nhiều công ty công nghiệp khác.","công ty tuyển dụng, evn, schneider electric, siemens, abb, ge, intel, mitsubishi, hitachi energy, infineon, bosch, vinfast"
Sinh viên ngành Kỹ thuật Điện có những loại học bổng nào?,"Sinh viên có nhiều cơ hội nhận học bổng khuyến học của Trường, học bổng từ doanh nghiệp (PTSC, Fujikura) và cựu sinh viên.","học bổng, khuyến học, học bổng doanh nghiệp, học bổng cựu sinh viên"
Sinh viên tốt nghiệp có cơ hội nhận học bổng sau đại học ở nước ngoài không?,"Nhiều cựu sinh viên đã nhận học bổng toàn phần theo học chương trình sau đại học tại Mỹ, Pháp, Đức, Nhật, Hàn Quốc.","học bổng sau đại học, mỹ, pháp, đức, nhật, hàn quốc"
Làm thế nào để liên hệ với Khoa Điện - Điện tử?,"Có thể liên hệ tại Tòa B1, Trường ĐH Bách khoa - ĐHQG-HCM, 268 Lý Thường Kiệt, Phường 14, Quận 10, TP. Hồ Chí Minh hoặc qua các địa chỉ email được cung cấp.","liên hệ, khoa điện điện tử, địa chỉ, email"
