question,answer,keyword
Ngành Kỹ thuật Hóa học phù hợp với những sinh viên nào?,"Ngành phù hợp cho sinh viên yêu thích làm việc trong lĩnh vực công nghiệp hóa học, thiết kế các quá trình công nghiệp, nghiên cứu phát triển quá trình mới hướng đến bền vững, an toàn, hiệu quả.","kỹ thuật hóa học, công nghiệp hóa học, thiết kế quá trình, nghiên cứu phát triển"
Các lĩnh vực chuyên môn chính của ngành Kỹ thuật Hóa học là gì?,"Ngành tập trung đặc biệt trong các lĩnh vực: lọc - hóa dầu, hóa dược, mỹ phẩm, vật liệu, xử lý môi trường, năng lượng, sản xuất sản phẩm hóa học, kỹ thuật phân tích, công nghệ điện hóa - chống ăn mòn.","lĩnh vực chuyên môn, lọc hóa dầu, hóa dược, mỹ phẩm, vật liệu, xử lý môi trường, năng lượng"
Chương trình đào tạo ngành Kỹ thuật Hóa học bao gồm những gì?,Chương trình gồm các môn cốt lõi về Kỹ thuật Hóa học và nhiều môn lựa chọn về công nghệ chuyên ngành.,"chương trình đào tạo, môn cốt lõi, môn lựa chọn, công nghệ chuyên ngành"
"Từ năm 2024, ngành Kỹ thuật Hóa học có chuyên ngành mới nào không?","Có, từ năm 2024, hai chuyên ngành đào tạo mới là công nghệ hóa dược và công nghệ mỹ phẩm sẽ được triển khai.","chuyên ngành mới, công nghệ hóa dược, công nghệ mỹ phẩm, 2024"
Sinh viên tốt nghiệp ngành Kỹ thuật Hóa học có thể làm gì?,"Sinh viên sẽ trở thành kỹ sư có tay nghề cao, có thể phát triển, thiết kế và tính toán các giải pháp kỹ thuật về quy trình công nghệ, sản phẩm mới, nghiên cứu khoa học.","tốt nghiệp, kỹ sư, phát triển, thiết kế, tính toán, giải pháp kỹ thuật, nghiên cứu khoa học"
Chương trình đào tạo ngành Kỹ thuật Hóa học có liên kết với sau đại học không?,"Có, chương trình được gắn kết với chương trình đào tạo thạc sỹ/tiến sỹ ngành Kỹ thuật Hóa học tại Trường Đại học Bách khoa - ĐHQG-HCM.","chương trình đào tạo, liên kết, thạc sỹ, tiến sỹ"
Mã ngành Kỹ thuật Hóa học hệ Tiêu chuẩn là bao nhiêu?,Mã ngành Chương trình Tiêu chuẩn là 114.,"mã ngành, chương trình tiêu chuẩn, 114"
Mã ngành Kỹ thuật Hóa học hệ Dạy và học bằng tiếng Anh là bao nhiêu?,Mã ngành Chương trình Dạy và học bằng tiếng Anh là 214.,"mã ngành, chương trình tiếng anh, 214"
Nội dung chương trình đào tạo mang lại lợi ích gì cho sinh viên?,Nội dung chương trình cung cấp kiến thức nền tảng vững chắc giúp sinh viên dễ dàng tiếp thu kiến thức chuyên sâu và dễ dàng tiếp cận các lĩnh vực liên quan khác.,"nội dung chương trình, kiến thức nền tảng, kiến thức chuyên sâu, lĩnh vực liên quan"
Sinh viên dễ dàng tiếp thu kiến thức chuyên sâu nào?,"Sinh viên dễ dàng tiếp thu các kiến thức chuyên sâu như: lọc hóa dầu, hóa dược, công nghệ hóa hữu cơ, công nghệ hóa vô cơ, công nghệ điện hóa - chống ăn mòn.","kiến thức chuyên sâu, lọc hóa dầu, hóa dược, hóa hữu cơ, hóa vô cơ, điện hóa chống ăn mòn"
Sinh viên có thể tiếp cận các lĩnh vực liên quan nào?,"Sinh viên dễ dàng tiếp cận các kiến thức về các lĩnh vực liên quan khác như: công nghệ thực phẩm, công nghệ sinh học, công nghệ vật liệu, công nghệ môi trường.","lĩnh vực liên quan, công nghệ thực phẩm, công nghệ sinh học, công nghệ vật liệu, công nghệ môi trường"
Trường có chương trình kỹ sư tài năng cho ngành này không?,"Có, chương trình kỹ sư tài năng dành cho các sinh viên giỏi được tuyển chọn từ cuối năm thứ nhất.","chương trình kỹ sư tài năng, sinh viên giỏi"
Đội ngũ giảng viên Khoa Kỹ thuật Hóa học có trình độ thế nào?,"Khoa có 67 giảng viên có bằng Tiến sĩ, đa số đào tạo ở nước ngoài, trong đó có 30 Giáo sư và Phó Giáo sư.","đội ngũ giảng viên, tiến sĩ, giáo sư, phó giáo sư"
Nhà trường hỗ trợ sinh viên học tập bằng cách nào?,"Hỗ trợ bằng hệ thống quản lý tiến độ học tập online, hệ thống hỗ trợ học tập - giảng dạy online, hệ thống giáo viên chủ nhiệm tư vấn sinh viên.","hỗ trợ sinh viên, quản lý tiến độ học tập, hỗ trợ học tập giảng dạy, giáo viên chủ nhiệm"
Cơ sở vật chất của Khoa Kỹ thuật Hóa học như thế nào?,Khoa có cơ sở vật chất chất lượng cao với hệ thống phòng thí nghiệm chuyên ngành.,"cơ sở vật chất, phòng thí nghiệm, chất lượng cao"
Khoa có những phòng thí nghiệm chuyên ngành nào?,"Có các phòng thí nghiệm chuyên ngành như Hóa Hữu cơ, Hóa dược, Mỹ phẩm, Hóa Vô cơ, Hóa lý và Phân tích, Hóa dầu, Quá trình và thiết bị.","phòng thí nghiệm chuyên ngành, hóa hữu cơ, hóa dược, mỹ phẩm, hóa vô cơ, hóa lý, hóa dầu, quá trình thiết bị"
Các phòng thí nghiệm được sử dụng vào mục đích gì?,"Phục vụ giảng dạy thí nghiệm, sinh viên nghiên cứu khoa học, triển khai hoạt động nghiên cứu khoa học liên kết với doanh nghiệp và hợp tác quốc tế.","giảng dạy thí nghiệm, nghiên cứu khoa học, liên kết doanh nghiệp, hợp tác quốc tế"
Cơ hội việc làm sau tốt nghiệp ngành Kỹ thuật Hóa học có tốt không?,Các Kỹ sư Hóa học sau khi tốt nghiệp được nhà tuyển dụng quan tâm cao và sẽ thành công trong nhiều lĩnh vực khác nhau.,"cơ hội việc làm, tốt nghiệp, kỹ sư hóa học, nhà tuyển dụng"
Sinh viên tốt nghiệp có thể đảm nhận các công việc nào?,"Bao gồm quản lý vận hành, thiết kế và tính toán hệ thống, nghiên cứu và phát triển sản phẩm, phân tích - quản lý chất lượng sản phẩm trong nhiều lĩnh vực.","công việc, quản lý vận hành, thiết kế tính toán, nghiên cứu phát triển, phân tích quản lý chất lượng"
Một số vị trí việc làm cụ thể cho Kỹ sư Hóa học là gì?,"Có thể làm Nhân viên quản lý bộ phận kỹ thuật, Điều hành sản xuất, Nghiên cứu và phát triển (R&D), Kiểm soát chất lượng, Phát triển và quản lý dự án.","vị trí việc làm, quản lý kỹ thuật, điều hành sản xuất, R&D, kiểm soát chất lượng, quản lý dự án"
Sinh viên tốt nghiệp có thể làm việc ở đâu ngoài công ty sản xuất?,"Có thể làm Nhân viên quản lý bộ phận liên quan đến khoa học - công nghệ trong các cơ quan, tổ chức nhà nước hoặc Giảng viên/Nghiên cứu viên tại trường đại học, viện nghiên cứu.","cơ quan nhà nước, giảng viên, nghiên cứu viên, trường đại học, viện nghiên cứu"
Khoa Kỹ thuật Hóa học có hợp tác với doanh nghiệp không?,"Có, Khoa có hệ thống doanh nghiệp đối tác trong đào tạo cũng như tuyển dụng.","quan hệ hợp tác, doanh nghiệp đối tác, đào tạo, tuyển dụng"
Một số công ty/tập đoàn là đối tác của Khoa là gì?,"Các đối tác như Tập đoàn Dầu khí quốc gia Việt Nam, Technip, Toyo, Samsung, Intel, Domesco, Acecook, Unilever, P&G, Insee, Bình Điền, v.v.","công ty đối tác, tập đoàn, dầu khí, thực phẩm dược phẩm, hàng tiêu dùng, môi trường"
Sinh viên có cơ hội nhận học bổng không?,"Có, sinh viên có thể nhận học bổng từ nhiều nguồn khác nhau.","học bổng, nguồn học bổng"
Các loại học bổng mà sinh viên có thể nhận là gì?,"Có học bổng khuyến khích Học tập, học bổng từ các Đại học đối tác, học bổng từ các tổ chức, doanh nghiệp như Vingroup, Acecook Việt Nam, v.v.","học bổng khuyến khích học tập, học bổng đại học đối tác, học bổng tổ chức doanh nghiệp"
Sinh viên có cơ hội đi học Sau đại học ở nước ngoài không?,"Có, sinh viên có nhiều cơ hội học tập nâng cao trình độ ở nước ngoài nhờ mối quan hệ hợp tác với nhiều trường đại học danh tiếng thế giới.","học bổng sau đại học, học tập nước ngoài, hợp tác quốc tế"
Có học bổng trao đổi sinh viên quốc tế không?,"Có, có học bổng trao đổi sinh viên và học bổng từ các ĐH đối tác như Úc, Mỹ, Nhật, Hàn Quốc.","học bổng trao đổi sinh viên, học bổng đại học đối tác, úc, mỹ, nhật, hàn quốc"
Làm thế nào để liên hệ với Khoa Kỹ thuật Hóa học?,"Có thể liên hệ tại Tòa B2, Trường ĐH Bách khoa - ĐHQG-HCM, số điện thoại 028 3865 0484 hoặc truy cập website che.hcmut.edu.vn.","liên hệ, địa chỉ, số điện thoại, website"
