question,answer,keyword
Sinh viên ngành Quản lý Tài nguyên và Môi trường được trang bị những kiến thức gì?,"Chương trình trang bị kiến thức quản lý môi trường, tài nguyên, HSE, quan trắc, đánh giá tác động, ứng dụng GIS/Viễn thám, công nghệ kiểm soát ô nhiễm, Biến đổi Khí hậu, Công nghệ Xanh.","kiến thức quản lý môi trường, quản lý tài nguyên, hse, quan trắc môi trường, đánh giá tác động, gis, viễn thám, công nghệ kiểm soát ô nhiễm, biến đổi khí hậu, công nghệ xanh"
Chương trình đào tạo ngành Quản lý Tài nguyên và Môi trường sử dụng phương pháp tiếp cận nào?,Chương trình đào tạo được xây dựng theo cách tiếp cận CDIO và phù hợp với khung năng lực trình độ quốc gia VQF.,"cdio, vqf, khung năng lực trình độ quốc gia"
Ngành Quản lý Tài nguyên và Môi trường đã đạt kiểm định quốc tế ASIIN chưa?,"Có, chương trình đào tạo của ngành đã đạt chuẩn kiểm định quốc tế ASIIN từ năm 2022.","kiểm định quốc tế, asiin, chuẩn asiin"
Mã ngành Quản lý Tài nguyên và Môi trường cho chương trình Tiêu chuẩn là bao nhiêu?,Mã ngành cho chương trình Tiêu chuẩn là 125.,"mã ngành, chương trình tiêu chuẩn, 125"
Mã ngành Quản lý Tài nguyên và Môi trường cho chương trình Dạy và học bằng tiếng Anh là bao nhiêu?,Mã ngành cho chương trình Dạy và học bằng tiếng Anh là 225.,"mã ngành, chương trình tiếng anh, 225"
Ngành Quản lý Tài nguyên và Môi trường có những loại chương trình đào tạo nào?,"Ngành có các chương trình đào tạo gồm: Chương trình Tiêu chuẩn (4 năm), Chương trình Dạy và học bằng tiếng Anh (4 năm), Chương trình Cử nhân – Thạc sĩ (6 năm), Chương trình Liên thông Thạc sĩ (5 năm).","chương trình đào tạo, chương trình tiêu chuẩn, chương trình tiếng anh, cử nhân thạc sĩ, liên thông thạc sĩ"
Chương trình Dạy và học bằng tiếng Anh ngành Quản lý Tài nguyên và Môi trường được tổ chức ở cơ sở nào?,Chương trình này được tổ chức tại Cơ sở Lý Thường Kiệt (Quận 10).,"chương trình tiếng anh, cơ sở lý thường kiệt, quận 10"
Phòng Thí nghiệm trọng tâm phục vụ giảng dạy và nghiên cứu cho ngành là gì?,Phòng Thí nghiệm trọng tâm và chủ yếu phục vụ giảng dạy và nghiên cứu là Phòng Thí nghiệm Phân tích Môi trường (Environmental Analysis Laboratory).,"phòng thí nghiệm, phân tích môi trường, environmental analysis laboratory"
Diện tích của Phòng Thí nghiệm Phân tích Môi trường tại Cơ sở 1 và Cơ sở 2 là bao nhiêu?,Phòng Thí nghiệm này có diện tích 550 m2 tại Cơ sở 1 và 2.000 m2 tại Cơ sở 2 (Dĩ An).,"diện tích phòng thí nghiệm, cơ sở 1, cơ sở 2, dĩ an"
Sinh viên tốt nghiệp ngành Quản lý Tài nguyên và Môi trường có thể làm việc ở những đâu?,"Sinh viên có thể làm việc tại các cơ quan quản lý nhà nước (Sở TNMT, Phòng TNMT), khu công nghiệp/chế xuất, công ty tư vấn môi trường, viện nghiên cứu, tổ chức phi chính phủ, doanh nghiệp/nhà máy.","vị trí việc làm, cơ quan quản lý nhà nước, công ty tư vấn môi trường, viện nghiên cứu, tổ chức phi chính phủ, doanh nghiệp"
Ngành Quản lý Tài nguyên và Môi trường có mối quan hệ hợp tác tuyển dụng với những đối tác nào?,"Ngành hợp tác tuyển dụng với Bộ TNMT, Cục Môi trường, Sở TNMT, các Ban/Ngành môi trường địa phương, các doanh nghiệp như KCN Hiệp Phước, Wilo Vietnam, Hưng Thịnh Group và các công ty tư vấn.","hợp tác tuyển dụng, bộ tnmt, cục môi trường, sở tnmt, công ty tư vấn, kcn hiệp phước, wilo vietnam, hưng thịnh group"
Có những nguồn học bổng nào dành cho sinh viên ngành Quản lý Tài nguyên và Môi trường được đề cập?,"Các nguồn học bổng trong và ngoài nước được đề cập bao gồm NK Lee, Han Team Scholarship, Jabil VietNam, HB Lâm Minh Triết, HB Vươn lên VN, PVEP, HB Lương Định Của, HB Đồng Hành.","học bổng, nk lee, han team, jabil vietnam, lâm minh triết, vươn lên vn, pvep, lương đình của, đồng hành"
Sinh viên có cơ hội nhận học bổng từ các dự án quốc tế nào?,"Sinh viên có cơ hội nhận học bổng từ các dự án quốc tế như JICA Knowledge Co-Creation Program, AUN-SEED Net, Erasmus+ (Châu Âu), SEED (Canada).","học bổng dự án quốc tế, jica, aun-seed net, erasmus+, seed canada"
Địa chỉ liên hệ của ngành Quản lý Tài nguyên và Môi trường là gì?,"Địa chỉ liên hệ là Nhà 89, Trường Đại học Bách khoa - ĐHQG-HCM, 268 Lý Thường Kiệt, Phường 14, Quận 10, TP. Hồ Chí Minh.","địa chỉ liên hệ, nhà 89, lý thường kiệt, quận 10"
Số điện thoại liên hệ của ngành Quản lý Tài nguyên và Môi trường là gì?,Số điện thoại liên hệ là 028 3863 9682.,"số điện thoại liên hệ, 028 3863 9682"
Trang web chính thức của ngành Quản lý Tài nguyên và Môi trường là gì?,Trang web chính thức là fenr.hcmut.edu.vn.,"trang web, website, fenr.hcmut.edu.vn"
Địa chỉ Email liên hệ của ngành Quản lý Tài nguyên và Môi trường là gì?,Địa chỉ Email liên hệ là kmt@hcmut.edu.vn.,"email liên hệ, kmt@hcmut.edu.vn"
