question,answer,keyword
Chuyên ngành Thiết kế Vi mạch thuộc ngành nào?,Thuộc ngành Điện tử - Viễn Thông.,"chuyên ngành, ngành, điện tử viễn thông"
Chuyên ngành Thiết kế Vi mạch được đánh giá như thế nào?,"Là ngành đào tạo chất lượng cao, có tính ứng dụng cao và mang tính xu hướng toàn cầu.","chuyên ngành, đánh giá, chất lượng cao, ứng dụng cao, xu hướng toàn cầu"
Những tiến bộ công nghệ nổi bật trong thế kỷ XXI được đề cập là gì?,"Trí tuệ nhân tạo (AI), điện toán đám mây, phân tích dữ liệu lớn (Big Data).","tiến bộ công nghệ, thế kỷ xxi, ai, điện toán đám mây, big data"
"Việc áp dụng các kỹ thuật AI, điện toán đám mây, Big Data yêu cầu gì về vi mạch?","Yêu cầu sự gia tăng đột biến việc sử dụng các chip, vi mạch điện tử trên toàn cầu.","áp dụng kỹ thuật, yêu cầu vi mạch, gia tăng sử dụng chip, vi mạch"
Nhu cầu xã hội về kỹ sư Thiết kế Vi mạch có trình độ cao như thế nào?,Xã hội đòi hỏi ngày càng tăng nhu cầu tuyển dụng các kỹ sư Thiết kế Vi mạch có trình độ cao.,"nhu cầu xã hội, kỹ sư thiết kế vi mạch, trình độ cao"
Các kỹ sư Thiết kế Vi mạch có trình độ cao có thể làm việc ở đâu?,"Trong các công ty vi mạch trong và ngoài nước, hoặc nghiên cứu, phát triển chip ứng dụng.","kỹ sư thiết kế vi mạch, nơi làm việc, công ty vi mạch, nghiên cứu phát triển"
Nhu cầu tuyển dụng kỹ sư Thiết kế Vi mạch tăng tạo cơ hội gì cho ngành?,Đây là cơ hội để ngành Thiết kế Vi mạch phát triển.,"nhu cầu tuyển dụng, cơ hội phát triển, ngành thiết kế vi mạch"
Chương trình đào tạo tại Trường Đại học Bách khoa hướng tới giúp sinh viên phát triển điều gì?,Giúp sinh viên phát triển kỹ năng toàn diện và trở thành những chuyên gia trong lĩnh vực thiết kế vi mạch.,"chương trình đào tạo, phát triển kỹ năng, chuyên gia, thiết kế vi mạch"
Chương trình đào tạo ngành Thiết kế Vi mạch đáp ứng nhu cầu nào cho các công ty?,Đáp ứng nhu cầu về nguồn lực cho các công ty vi mạch.,"chương trình đào tạo, đáp ứng nhu cầu, công ty vi mạch, nguồn lực"
Sinh viên tốt nghiệp từ chương trình có khả năng giải quyết loại thách thức nào?,Có khả năng giải quyết các thách thức công nghệ của thời đại.,"sinh viên tốt nghiệp, khả năng, thách thức công nghệ"
Chương trình đào tạo tập trung vào phát triển những kỹ năng chuyên môn nào cho sinh viên tốt nghiệp?,"Kỹ năng nghiên cứu, thiết kế và ứng dụng công nghệ vi mạch vào đời sống.","chương trình đào tạo, kỹ năng chuyên môn, nghiên cứu, thiết kế, ứng dụng vi mạch"
"Ngoài kỹ năng chuyên môn, chương trình đào tạo còn phát triển kỹ năng gì khác?",Kỹ năng mềm để sinh viên phát triển toàn diện.,"kỹ năng mềm, phát triển toàn diện"
Kỹ năng mềm giúp sinh viên gợi mở những khả năng nào?,"Khả năng tư duy, nghiên cứu, sáng tạo.","kỹ năng mềm, tư duy, nghiên cứu, sáng tạo"
Sinh viên được phát triển khả năng thích nghi với điều gì qua chương trình đào tạo?,Thích nghi với sự phát triển không ngừng của công nghệ trong thời đại mới.,"thích nghi, phát triển công nghệ, thời đại mới"
Chương trình đào tạo ngành Thiết kế Vi mạch đóng góp gì cho xã hội?,Đóng góp cho sự phát triển của xã hội.,"đóng góp xã hội, phát triển xã hội"
Mã ngành cho Chương trình Tiêu chuẩn của Thiết kế Vi mạch là bao nhiêu?,108.,"mã ngành, chương trình tiêu chuẩn, 108"
Mã ngành cho Chương trình Tiên tiến của Thiết kế Vi mạch là bao nhiêu?,208.,"mã ngành, chương trình tiên tiến, 208"
Chương trình đào tạo chuyên ngành Thiết kế Vi mạch được ai đánh giá cao?,"Được đánh giá cao bởi các doanh nghiệp, nhà tuyển dụng.","chương trình đào tạo, đánh giá cao, doanh nghiệp, nhà tuyển dụng"
Chương trình đào tạo có đạt chuẩn quốc tế không?,"Có, chương trình đào tạo đạt chuẩn quốc tế.","chương trình đào tạo, chuẩn quốc tế"
Chương trình đào tạo đã được kiểm định thành công theo tiêu chuẩn nào?,Đã được kiểm định thành công theo tiêu chuẩn AQAS.,"kiểm định, tiêu chuẩn aqas"
Đâu là điểm mạnh của chương trình đào tạo liên quan đến công nghệ?,Sự cập nhật liên tục theo sự phát triển của công nghệ vi mạch trên thế giới.,"điểm mạnh, cập nhật công nghệ, công nghệ vi mạch thế giới"
Việc cập nhật liên tục theo công nghệ thế giới mang lại lợi ích gì cho sinh viên tốt nghiệp?,Đem lại khả năng hội nhập quốc tế và làm việc tại công ty đa quốc gia trong/ngoài nước.,"cập nhật công nghệ, lợi ích, hội nhập quốc tế, công ty đa quốc gia"
Sinh viên tốt nghiệp có cơ hội học tập bậc cao hơn ở đâu?,Có cơ hội học tập bậc cao hơn trong và ngoài nước.,"cơ hội học tập, bậc cao hơn, trong nước, ngoài nước"
Các môn học trong chương trình được thiết kế liên quan đến những công nghệ tiên tiến nào?,"Vi điều khiển, FPGA và SoC.","môn học, công nghệ tiên tiến, vi điều khiển, fpga, soc"
Các môn học liên quan đến công nghệ tiên tiến có đặc điểm gì về nội dung?,Luôn được cập nhật.,"môn học, công nghệ tiên tiến, cập nhật"
Sinh viên chuyên ngành Thiết kế Vi mạch học tập trong môi trường cơ sở vật chất như thế nào?,Học tập trong các phòng thí nghiệm được trang bị cơ sở vật chất hiện đại.,"sinh viên, học tập, cơ sở vật chất, phòng thí nghiệm hiện đại"
Những phòng thí nghiệm chuyên biệt nào nổi bật phục vụ ngành học?,"Phòng thí nghiệm thiết kế vi mạch, vi mạch cao tần và MEMS.","phòng thí nghiệm chuyên biệt, thiết kế vi mạch, vi mạch cao tần, mems"
Các phòng thí nghiệm chuyên biệt được trang bị thiết bị ở mức độ nào?,Được trang bị các thiết bị hiện đại và đầy đủ nhất.,"phòng thí nghiệm, trang bị thiết bị, hiện đại, đầy đủ nhất"
Mục đích của việc trang bị thiết bị hiện đại cho các phòng thí nghiệm là gì?,Đáp ứng yêu cầu giảng dạy và nghiên cứu của sinh viên về thiết kế vi mạch.,"mục đích trang bị, giảng dạy, nghiên cứu, thiết kế vi mạch"
Sinh viên được trang bị loại phần mềm nào tại phòng thí nghiệm?,"Các phần mềm mô phỏng, tính toán.","phần mềm mô phỏng, phần mềm tính toán"
"Ai hỗ trợ việc cung cấp các phần mềm mô phỏng, tính toán cho sinh viên?",Các công ty vi mạch hỗ trợ.,"hỗ trợ phần mềm, công ty vi mạch"
"Việc sử dụng phần mềm mô phỏng, tính toán giúp sinh viên điều gì?",Giúp sinh viên tiếp cận và áp dụng kiến thức vào thực tế một cách hiệu quả.,"sử dụng phần mềm, tiếp cận kiến thức, áp dụng kiến thức, thực tế"
Ngành Thiết kế Vi mạch có nhiều cơ hội nghề nghiệp không?,"Có, đây là một trong những lĩnh vực có nhiều cơ hội nghề nghiệp.","cơ hội nghề nghiệp, ngành thiết kế vi mạch"
Sự quan tâm của nhà tuyển dụng đối với ngành Thiết kế Vi mạch như thế nào?,Được các nhà tuyển dụng quan tâm cao.,"nhà tuyển dụng, quan tâm cao"
Sinh viên tốt nghiệp có thể làm những công việc gì liên quan đến vi mạch?,"Thiết kế, phát triển, sản xuất, kiểm định vi mạch.","sinh viên tốt nghiệp, công việc, thiết kế, phát triển, sản xuất, kiểm định vi mạch"
Trường Đại học Bách khoa là đối tác chiến lược với những công ty hàng đầu thế giới nào trong lĩnh vực này?,"INTEL, Renesas, MARVELL, ARM, Texas Instruments, Qualcomm, Samsung, Ampere, Savarti, Faraday, Realtek.","đối tác chiến lược, công ty hàng đầu, intel, renesas, marvell, arm, texas instruments, qualcomm, samsung, ampere, savarti, faraday, realtek"
Các công ty đối tác đánh giá cao điều gì ở sinh viên Trường Đại học Bách khoa?,Đánh giá cao năng lực chuyên môn và sự sáng tạo.,"công ty đối tác, đánh giá sinh viên, năng lực chuyên môn, sự sáng tạo"
Sinh viên sau khi tốt nghiệp có cơ hội được tuyển dụng bởi các công ty đối tác không?,"Có, các công ty đối tác tuyển dụng sinh viên sau khi tốt nghiệp.","cơ hội tuyển dụng, công ty đối tác, sinh viên tốt nghiệp"
Sinh viên đang theo học có cơ hội nào từ các công ty đối tác?,Thường xuyên có cơ hội thực tập từ các công ty đối tác.,"cơ hội thực tập, công ty đối tác, sinh viên đang học"
Trải nghiệm kỹ thuật thực tế là gì trong bối cảnh hợp tác với doanh nghiệp?,Là cơ hội có được khi thực tập tại các công ty đối tác.,"trải nghiệm kỹ thuật thực tế, thực tập, công ty đối tác"
Việc thực tập giúp sinh viên làm gì với kiến thức đã học?,Giúp áp dụng kiến thức đã học vào việc làm.,"thực tập, áp dụng kiến thức, việc làm"
Thực tập giúp sinh viên nắm bắt nhanh điều gì?,Nắm bắt nhanh những kỹ năng cần thiết cho ngành nghề này.,"thực tập, nắm bắt kỹ năng, kỹ năng cần thiết"
Doanh nghiệp hợp tác với Trường thông qua những hình thức nào?,"Tổ chức các workshop, hội thảo và các dự án nghiên cứu.","doanh nghiệp, hợp tác, workshop, hội thảo, dự án nghiên cứu"
Sinh viên có cơ hội tiếp xúc trực tiếp với ai qua các hoạt động hợp tác với doanh nghiệp?,Tiếp xúc trực tiếp với những chuyên gia hàng đầu trong lĩnh vực.,"tiếp xúc chuyên gia, chuyên gia hàng đầu"
Sinh viên được cập nhật những gì về công nghệ vi mạch qua các hoạt động hợp tác?,Cập nhật những công nghệ mới nhất trong lĩnh vực thiết kế vi mạch.,"cập nhật công nghệ, công nghệ mới nhất, thiết kế vi mạch"
Sinh viên học hỏi được điều gì qua các hoạt động hợp tác với doanh nghiệp?,Học hỏi kinh nghiệm thực tế.,"học hỏi, kinh nghiệm thực tế"
Sinh viên mở rộng kiến thức chuyên môn bằng cách nào thông qua hợp tác doanh nghiệp?,"Bằng cách tham gia workshop, hội thảo và dự án nghiên cứu.","mở rộng kiến thức, workshop, hội thảo, dự án nghiên cứu"
Địa chỉ liên hệ vật lý cho ngành Thiết kế Vi mạch tại Trường Đại học Bách khoa là gì?,"Phòng 201 Tòa Nhà B3, 268 Lý Thường Kiệt, Phường 14, Quận 10, TP. Hồ Chí Minh.","địa chỉ liên hệ, phòng 201 tòa nhà b3, 268 lý thường kiệt, tphcm"
Địa chỉ email để liên hệ với ngành là gì?,bmdt@hcmut.edu.vn.,"email liên hệ, bmdt@hcmut.edu.vn"
Trang web chính thức để tìm hiểu thông tin liên hệ của ngành là gì?,doe.dee.hcmut.edu.vn.,"trang web liên hệ, doe.dee.hcmut.edu.vn"
Ngành Thiết kế Vi mạch có kênh thông tin nào trên mạng xã hội Facebook không?,"Có, địa chỉ Facebook là www.facebook.com/Electronics.Dpt.HCMUT.","kênh thông tin, facebook, electronics.dpt.hcmut"
